{
  "schemaVersion": 1,
  "eventId": "90b8dcd8-949b-4726-88c3-f0e818559c33",
  "seq": "4",
  "projectId": "8a0f0ac0-ae54-4f1f-afbc-157ad34bf7ce",
  "runId": "bbf2a21a-4eb5-490e-86b6-3a43b451c81d",
  "entityId": "57a40946-c79b-4f3d-ab81-d8da50ad278f",
  "entityVersion": 1,
  "occurredAt": "2026-10-11T08:00:00Z",
  "type": "specification.revision_created",
  "payload": {
    "revision": "1"
  }
}
